{
  "candidates": [
    {
      "categories": [
        {
          "category": "amenities",
          "metrics": [
            {
              "active": true,
              "basis": "synthetic",
              "category": "amenities",
              "category_contribution": 26.15,
              "confidence": 0.8,
              "confidence_notes": "Synthetic POI example",
              "evidence_id": "welwyn-cafes",
              "metric": "cafes",
              "normalized_score": 62.75,
              "raw_value": 4,
              "source": "Synthetic LOCATION\u00b3 fixture",
              "source_date": "2026-08-01",
              "source_url": "https://github.com/lukexyz/location-location-location/tree/main/fixtures/demo",
              "unit": "count_15_min_walk",
              "weight": 5.0
            },
            {
              "active": true,
              "basis": "synthetic",
              "category": "amenities",
              "category_contribution": 12.9,
              "confidence": 0.75,
              "confidence_notes": "Synthetic POI example",
              "evidence_id": "welwyn-yoga",
              "metric": "yoga_studios",
              "normalized_score": 38.69,
              "raw_value": 1,
              "source": "Synthetic LOCATION\u00b3 fixture",
              "source_date": "2026-08-01",
              "source_url": "https://github.com/lukexyz/location-location-location/tree/main/fixtures/demo",
              "unit": "count_15_min_walk",
              "weight": 4.0
            },
            {
              "active": true,
              "basis": "synthetic",
              "category": "amenities",
              "category_contribution": 10.77,
              "confidence": 0.8,
              "confidence_notes": "Synthetic POI example",
              "evidence_id": "welwyn-grocers",
              "metric": "premium_grocers",
              "normalized_score": 43.07,
              "raw_value": 1,
              "source": "Synthetic LOCATION\u00b3 fixture",
              "source_date": "2026-08-01",
              "source_url": "https://github.com/lukexyz/location-location-location/tree/main/fixtures/demo",
              "unit": "count_15_min_walk",
              "weight": 3.0
            }
          ],
          "overall_contribution": 9.96,
          "score": 49.81,
          "weight": 2.0
        },
        {
          "category": "environment",
          "metrics": [
            {
              "active": true,
              "basis": "user_observed",
              "category": "environment",
              "category_contribution": 43.75,
              "confidence": 0.8867,
              "confidence_notes": "Personal audit is 12 days old",
              "evidence_id": "welwyn-street-care-score",
              "metric": "street_care",
              "normalized_score": 87.5,
              "raw_value": 87.5,
              "source": "Private structured visit audit",
              "source_date": "2026-07-20",
              "source_url": "https://github.com/lukexyz/location-location-location/blob/main/schemas/street-care-research.schema.json",
              "unit": "desirability_score",
              "weight": 3.0
            },
            {
              "active": true,
              "basis": "synthetic",
              "category": "environment",
              "category_contribution": 48.5,
              "confidence": 0.9,
              "confidence_notes": "Synthetic network-distance example",
              "evidence_id": "welwyn-garden-city",
              "metric": "green_space",
              "normalized_score": 97.0,
              "raw_value": 3,
              "source": "Synthetic LOCATION\u00b3 fixture",
              "source_date": "2026-08-01",
              "source_url": "https://github.com/lukexyz/location-location-location/tree/main/fixtures/demo",
              "unit": "walk_minutes",
              "weight": 3.0
            }
          ],
          "overall_contribution": 27.68,
          "score": 92.25,
          "weight": 3.0
        },
        {
          "category": "essentials",
          "metrics": [
            {
              "active": true,
              "basis": "synthetic",
              "category": "essentials",
              "category_contribution": 9.97,
              "confidence": 0.9,
              "confidence_notes": "Synthetic journey assembled from explicit door-to-door components.",
              "evidence_id": "welwyn-central-rail-commute",
              "metric": "door_to_door_commute",
              "normalized_score": 59.83,
              "raw_value": 58,
              "source": "Synthetic LOCATION\u00b3 timetable fixture",
              "source_date": "2026-08-01",
              "source_url": "https://github.com/lukexyz/location-location-location/tree/main/fixtures/demo",
              "unit": "minutes",
              "weight": 1.0
            },
            {
              "active": true,
              "basis": "synthetic",
              "category": "essentials",
              "category_contribution": 75.21,
              "confidence": 0.85,
              "confidence_notes": "Synthetic 36-month comparable-sales example with more than 20 matching transactions.",
              "evidence_id": "welwyn-housing-market-affordability",
              "metric": "housing_affordability",
              "normalized_score": 90.25,
              "raw_value": 0.78,
              "source": "Synthetic LOCATION\u00b3 sold-price fixture",
              "source_date": "2026-08-01",
              "source_url": "https://github.com/lukexyz/location-location-location/blob/main/fixtures/demo/housing.json",
              "unit": "budget_ratio",
              "weight": 5.0
            }
          ],
          "overall_contribution": 42.59,
          "score": 85.18,
          "weight": 5.0
        }
      ],
      "confidence": 82.96,
      "hard_constraints": {
        "results": [
          {
            "actual": 58,
            "metric": "door_to_door_commute",
            "operator": "<=",
            "status": "pass",
            "value": 65
          }
        ],
        "status": "pass"
      },
      "housing_summary": {
        "bedrooms": 2,
        "budget_gbp": 500000,
        "budget_period": "purchase",
        "budget_ratio": 0.78,
        "inventory_status": "not_checked",
        "market": {
          "basis": "synthetic",
          "candidate_id": "welwyn-garden-city",
          "confidence": 0.85,
          "confidence_notes": "Synthetic 36-month comparable-sales example with more than 20 matching transactions.",
          "geography": {
            "kind": "radius",
            "label": "2 km around Welwyn Garden City",
            "radius_km": 2
          },
          "id": "welwyn-housing-market",
          "listing_search_url": "https://www.rightmove.co.uk/property-for-sale.html",
          "period_end": "2026-07-31",
          "period_start": "2023-08-01",
          "sample_size": 28,
          "sources": [
            {
              "kind": "transactions",
              "label": "Synthetic LOCATION\u00b3 sold-price fixture",
              "licence": "CC0-1.0",
              "retrieved_at": "2026-08-01T12:00:00Z",
              "source_date": "2026-08-01",
              "url": "https://github.com/lukexyz/location-location-location/blob/main/fixtures/demo/housing.json"
            }
          ],
          "statistic": "median",
          "typical_cost_gbp": 390000
        },
        "mode": "buy",
        "property_type": "flat",
        "typical_cost_gbp": 390000
      },
      "id": "welwyn-garden-city",
      "informational_metrics": [
        {
          "active": false,
          "basis": "synthetic",
          "category": "amenities",
          "category_contribution": 0.0,
          "confidence": 0.8,
          "confidence_notes": "Synthetic POI example",
          "evidence_id": "welwyn-betting",
          "metric": "betting_shops",
          "normalized_score": 100.0,
          "raw_value": 0,
          "source": "Synthetic LOCATION\u00b3 fixture",
          "source_date": "2026-08-01",
          "source_url": "https://github.com/lukexyz/location-location-location/tree/main/fixtures/demo",
          "unit": "count_15_min_walk",
          "weight": 0.0
        }
      ],
      "location": {
        "latitude": 51.8032,
        "longitude": -0.2077
      },
      "missing_metrics": [],
      "name": "Welwyn Garden City",
      "overall_score": 80.23,
      "place_kind": "town",
      "rail_summary": {
        "fastest_total_minutes": 58,
        "journeys": [
          {
            "access_minutes": 8,
            "basis": "synthetic",
            "cancellation_percent": 2.0,
            "candidate_id": "welwyn-garden-city",
            "changes": 0,
            "confidence": 0.9,
            "confidence_notes": "Synthetic journey assembled from explicit door-to-door components.",
            "destination_label": "Central destination",
            "expected_wait_minutes": 7,
            "id": "welwyn-central-rail",
            "last_useful_departure": "2026-08-01T23:18:00+01:00",
            "london_arrival_station": "London King's Cross",
            "london_last_mile_minutes": 8,
            "origin_station": "Welwyn Garden City",
            "origin_station_crs": "WGC",
            "primary": true,
            "punctuality_percent": 90.1,
            "scheduled_rail_minutes": 35,
            "service_window": "Typical Tuesday arrival by 09:00",
            "services_per_hour": 4,
            "sources": [
              {
                "kind": "timetable",
                "label": "Synthetic LOCATION\u00b3 timetable fixture",
                "licence": "CC0-1.0",
                "retrieved_at": "2026-08-01T12:00:00Z",
                "source_date": "2026-08-01",
                "url": "https://github.com/lukexyz/location-location-location/tree/main/fixtures/demo"
              },
              {
                "kind": "performance",